Subject,Business Name,Website,Location / Areas Served,Services Offered,Project Scopes,Pricing,Differentiators / USPs,Certifications & Affiliations,Founder / Owner,Year Founded,Team Size,Error
"NEAT Method - neatmethod.com - National franchise with multiple LA locations (Los Angeles Northwest, Beverly Hills, Santa Monica, South Bay, Valley). Research their LA-specific services, pricing, and positioning.",NEAT Method,https://neatmethod.com/,"Los Angeles - South Bay, Los Angeles - Valley, Los Angeles - Northwest, Beverly Hills, Santa Monica","Single-space organization (closets, kitchens, home offices); Complete whole-home unpacking and setup for moves; Ongoing maintenance to preserve organizational systems; Specialized concierge services","Residential, Commercial, Moves, New Construction Consulting","Services for a typical single space start at $1,500-$2,500 for a team of two professionals; organizing materials are an additional cost. A budget of $2,500 or more is generally recommended for a comprehensive project.","Luxury, white-glove approach; Focus on creating a calm and sophisticated home; Customized solutions; National franchise with over 100 locations; Offers a proprietary line of organizing products",Featured in Real Simple; Affiliate program for content creators,"Ashley Murphy, Marissa Hagmeyer, and Molly Graves",2010,Franchise with 100+ locations,
"Shara Kay - sharakay.com - Beverly Hills-based Certified Professional Organizer (CPO). Research services, pricing, areas served, certifications.",Shara Kay,https://www.sharakay.com,"Beverly Hills, South Bay, Ventura, Santa Barbara",Home and office organization; Decluttering; Move management; Downsizing; Estate clear-outs; Wardrobe styling; Photo inventory; Organizing skills training; Maintenance visits,"Residential, Commercial, Moves, Estates","$100/hr for lead organizer, $80/hr for additional organizers; 4-hour minimum",Specializes in organizing for busy professionals; Team of 10 with varied specializations; Bilingual (Spanish) organizer available; In-house tech expert,Certified Professional Organizer (CPO); NAPO member; NAPO Los Angeles board member (former President),Shara Kay,2017,Team of 10,
"Composed Living - composedliving.com - Professional home organizing in Los Angeles. Research services, pricing, areas served, differentiators.",Composed Living,https://composedliving.com,"Los Angeles, surrounding areas",Home organizing; Move management; Office organization; Virtual home organizing; Home maintenance packages; Home preparedness plan,"Residential, Commercial, Moves",$185/hr per lead organizer; $75/hr per additional organizer; Virtual sessions from $150,"Systems-based approach; Non-judgmental, confidential, and client-led; Sustainable solutions that reduce waste and re-buying; Focus on the emotional side of organizing; Connection between physical space and emotional well-being",Featured in HGTV; BuzzFeed; Thrive; ApartmentTherapy; MyDomaine; mindbodygreen; Travel & Leisure; Reader's Digest; Domino,Elsa Elbert,2016,Team of 10+,
"Organizing Concepts and Designs (OCD) - organizingconceptsanddesigns.com - Professional organizing for home, office, moving, property clearances, staging and estate sales. Research services, pricing, areas served.",Organizing Concepts and Designs,http://organizingconceptsanddesigns.com,"Los Angeles County, San Fernando Valley, Ventura County, San Gabriel Valley",Home Organizing; Office Organizing; Move Management; Staging; Estate Sales; Estate Clearing,"Residential, Office, Moves, Staging, Estates",Not publicly listed,One-Stop-Shop; Vetted professionals for services they don't provide; No-judgement and total confidentiality; Teaches clients to maintain their newly organized environment; Team of seasoned organizers with diverse backgrounds and specializations,"Member of National Association of Professional Organizers (NAPO); Adheres to NAPO Code of Ethics; Janet Fishman: Certified Personal Document Specialist (C.P.D.S.), Certified Home Inventory Consultant (C.H.I.C.), member of APPO and ICD",Dina Braverman,2010,Team of 9+,
"Home Organizers Plus - homeorganizersplus.com - Claims to be number one organizing team in LA. Research services, pricing, areas served, differentiators.",Home Organizers Plus,https://homeorganizersplus.com,"Granada Hills, San Fernando Valley, and greater Los Angeles area",Home organizing; Closet organizing; Kitchen organizing; Pantry organizing; Bathroom organizing; Bedroom organizing; Laundry room organizing; Craft room organizing; Living space organizing; Home and commercial office organizing; Filing system creation; Emergency/Earthquake Preparedness Kits; Space planning; Time management assistance; Garage and shed organizing; On-going maintenance for organized spaces; Photo Scanning to SD card,"Residential, Commercial",Not publicly listed,"Husband and wife team; No subcontracting; Two organizers for the price of one; No hidden fees for consultation, research, shopping, or travel",Top 18 on Expertise.com,Tina and Greg Staffon,2006,Husband and wife team,
"Tidy Up Los Angeles - tidyuplosangeles.com - Professional organizer, KonMari Master Consultant Vivien Lee-Mayhue. Research services, pricing, certifications, areas served.",Tidy Up Los Angeles,http://tidyuplosangeles.com,"Agoura Hills, Bell Canyon, Beverly Hills, Brentwood, Burbank, Calabasas, Canoga Park, Cheviot Hills, Culver City, Downey, Encino, Glassell Park, Glendale, Granada Hills, Hollywood Hills, La Canada Flintridge, Long Beach, Loz Feliz, Malibu, Manhattan Beach, Marina Del Rey, Mission Hills, Mt Washington, North Hills, North Hollywood, Northridge, Pacific Palisades, Pasadena, Playa Del Rey, Redondo Beach, Reseda, Sherman Oaks, Santa Monica, Silver Lake, Studio City, Tarzana, Toluca Lake, Valley Village, Van Nuys, Venice, West Hollywood, West Hills, Westlake Village, Westwood, Woodland Hills, Wilshire",In-Home Tidying Sessions; Virtual Tidying Sessions; Personalized Organization Sessions; KonMari Method® Checklist; Donation Haul-Away; Tech Disposal,"Residential, Home, Closet, Kitchen, Office",$375 for 3-hour in-home session; $500 for 4-hour in-home session; $200 for 2-hour virtual session; Package deals available,KonMari certified; Specializes in empowering women; Offers donation haul-away and tech disposal; Focuses on using what you own; Provides trade discounts with The Container Store,Certified Master Level KonMari® Consultant,Vivien Lee-Mayhue,Not found,Solo with subcontractors,
"Organize with Leslie - organizewithleslie.com - Professional organizer in LA serving Santa Monica, Venice, Mar Vista, Culver City. Research services, pricing, areas served.",Organize with Leslie,https://www.organizewithleslie.com,"Santa Monica, Venice, Mar Vista, Culver City, Westchester, Century City, Beverlywood, West L.A., Westwood, Beverly Hills, Mid-City, West Hollywood, Hollywood, Hollywood Hills, Larchmont, Los Feliz, Silverlake, DTLA, Brentwood, Bel Air, Pacific Palisades, Malibu, Burbank, Studio City, Sherman Oaks, Encino, Tarzana, Woodland Hills, Calabasas",Home organizing; Decluttering; Kitchen organizing; Closet organizing; Garage organizing; Playroom organizing; Home office organizing,Residential,$125 per hour; Packages available with 5%-15% discount,Solo operator; Former educator (teacher and school principal); Specializes in organizing for families,Not found,Leslie Lainer,2020,Solo operator,
"Tidy LA - tidyla.com - Meredith Ryness, Certified KonMari Consultant with 150+ hours tidying. Research services, pricing, certifications, areas served.",Tidy LA,https://www.tidyla.com,"Los Angeles, Pasadena, San Marino, Highland Park, Silverlake, Los Feliz, Hollywood",Hands on Tidying; Decision making hybrid; Hands off Organizing; 30 minute consult; hands on decluttering and organizing; product recommendations; support and communication for your project; product purchases; donation drop off; junk haul coordination,"Residential, Moves",Tidying sessions with Meredith are $125 per hour (4 hour minimum). Tidying sessions with Meredith and an assistant organizer are $200/hour (4 hour minimum). Each additional organizer is $75/hour. Tidying sessions with a Tidy LA organizer (other than Meredith) are $100/hour (4 hour minimum).,"KonMari certified; Specializes in helping people who are drowning in stuff, preparing for a move, or need help setting up organizational systems",Master Level Certified KonMari Consultant; Featured in Redfin,Meredith Ryness,2016,Team of 2+,
"Beautiful Life Creative - beautifullifela.com - Home organizer in LA creating custom organizing solutions blending with home design. Research services, pricing, areas served.",Beautiful Life Creative Organizing,http://beautifullifela.com,"Los Angeles, Pasadena, Burbank","In-person organizing; Relocation move management; Refresh services (weekly, monthly, or quarterly); Business organizing; Decluttering","Residential, Commercial, Moves",Meet & Greet Fee: $125; In-Person Organizing: Investment starts at $600; Refresh Service: Starting at $325 for 3 hours; Relocation Management: Custom pricing,"Blends organizing with home design and lifestyle; Focus on busy families and professionals; Creates personalized, step-by-step organizing plans; Offers luxury, stress-free relocation services",Featured in The Spruce,Sarah Schier,Not found,Team of organizers,
"The Beverly Hills Organizer - thebeverlyhillsorganizer.com - Discreet high-end professional organizing and design services for homes, estates, and lifestyles in Beverly Hills and LA. Research services, pricing, differentiators.",The Beverly Hills Organizer,https://thebeverlyhillsorganizer.com,"Beverly Hills, Los Angeles, Nationwide, Abroad",Closet Organization & Wardrobe Editing; Custom Closet Design; Home Organization; White Glove Relocation & Moving Organization; Prep for Staging & Home Sales; Estate & Legacy Organizing; Lifestyle & Concierge Organizing,"Residential, Estates, Moves",Not publicly listed,"Discreet high-end professional organizing; 35+ years of experience; Blends efficiency, psychology, and luxury design; White-glove service; Founder personally oversees every project; Upright Folding Method",Published author; Former co-host of a national television series,Linda Koopersmith,Not found,Solo with a trusted team,
"The Haute Suite / Alana's Organizing - alanasorganizing.com - Premier home organization services in Beverly Hills and Brentwood. Research services, pricing, areas served.",The Haute Suite / Alana's Organizing,https://alanasorganizing.com,"San Diego, Los Angeles, La Jolla, Coronado, Del Mar, Rancho Santa Fe, Pacific Palisades, Brentwood, Santa Monica, Solana Beach, Encinitas, Carmel Valley, Fairbanks Ranch, Beverly Hills, Manhattan Beach, Palm Springs",Luxury Move Management; Post-Move Home Setup & Refinement; Unpacking; Home Organizing; Kitchen & Pantry Organizing; Closet Organizing; Bathroom Organizing; Nursery & Playroom Organizing; Garage & Storage Organizing; Home Office Organizing,"Residential, Luxury Homes, Whole Home Renovations, Beachfront Properties",Not publicly listed; custom quotes provided. Design fee of $300-$500+.,Luxury move management; White-glove service; Specializes in high-end residential market; Turnkey experiences; Focus on creating calm and intentional transitions,Top professional organizer on FindMyOrganizer.com,Alana Frost,Not found,Team of 5+,
"Ethereal Edits - etherealedits.com - White-glove home organizing and move concierge service in LA. Research services, pricing, areas served, differentiators.",Ethereal Edits,https://etherealedits.com,"South Bay, Manhattan Beach, Palos Verdes, Beverly Hills, Brentwood, Santa Monica, Orange County",Home organizing; Closet organizing; Move management; Unpacking; Decluttering; Space planning; Shopping for organizational products; Implementing organizational systems; Digital organization; Donation transport; Junk removal,"Residential, Relocations, Remodels","Small Spaces: Starts at $3,500 USD; Large Spaces: Starts at $5,500 USD; Extensive Spaces: Starts at $20,000 USD",White-glove service; Move concierge; KonMari certified; Focus on intentionality and creating calm; Works with discerning individuals; Offers maintenance packages,KonMari Master Consultant,Elissa Giwner,Not found,Team of 2+ professionals,
"Design Organized by Lisa Shields - designorganized.com - Professional organizer, home decorator, and interior plant designer in LA. Research services, pricing, areas served.",Design Organized by Lisa Shields,https://www.designorganized.com,"Bel Air, Brentwood, Pacific Palisades, Beverly Hills, Malibu, Calabasas, Studio City, Pasadena, Eagle Rock, Larchmont, Santa Monica, Venice, Sherman Oaks, Culver City, Hollywood, Westwood, Marina Del Rey, Highland Park, Playa Del Rey, Manhattan Beach, Woodland Hills, West Hollywood, Burbank, Glendale, Century City, Larchmont, Encino, Echo Park, Silverlake",Residential Organizing; Commercial Organizing; Interior Plant Design; Landscaping; Patioscaping; Plant Maintenance,"Residential, Commercial",Consultations: $95-$150/hour; Hourly Rate: $95-$150/hour (4-hour minimum); Flat rates may be provided; Travel time may be billed if over 30 minutes.,Organizer and interior plant designer; Celebrity clientele; Specializes in hard to kill low maintenance interior plants and drought tolerant exterior plants,Featured in RUE MAGAZINE; Featured in REDFIN,Lisa Shields,2014,Solo with trusted employees and resources as needed,
"Free Your Space by Michelle Garb - freeyourspacenow.com - Sherman Oaks based, organized 500+ homes since 2015. Research services, pricing, areas served.",Free Your Space by Michelle Garb,https://www.freeyourspacenow.com/,"Calabasas, Woodland Hills, Tarzana, Encino, Sherman Oaks, Studio City, North Hollywood, Van Nuys, Reseda, Canoga Park, Northridge, Porter Ranch, Hidden Hills, West Los Angeles, Santa Monica, Beverly Hills",Home organizing; Hoarding help; Decluttering; Closet organization; Lifestyle transformation; Emotional support; Judgment-free organizing,Residential,Not publicly listed,Hoarding recovery; Emotional support; Judgment-free organizing; Focus on the emotional and psychological aspects of decluttering,Not found,Michelle Garb,2015,Solo with subcontractors,
"Clutter Healing by Lili Pettit - clutterhealing.com - Brentwood-based, combines home organizing with breathwork meditation. Research services, pricing, areas served, unique approach.",Clutter Healing,https://clutterhealing.com/,"Brentwood, Greater Los Angeles area",Home organizing; Breathwork meditation; Closet design and organization; Decluttering and downsizing services; Digital decluttering; Emergency and disaster preparedness; Garage design and organization; Moving and relocation services; 1:1 Clutter Healing Guidance Session,"Residential, Moves, Estates",Not publicly listed,Combines home organizing with breathwork meditation; Focuses on the emotional and spiritual aspects of decluttering; Conscious consuming education; Promotion of non-toxic products; Celebrity clientele,Featured in MindBodyGreen; Featured in In Style Magazine,Lili Pettit,2011,Team of 5+,
"Horderly - horderly.com - Professional organizing company with 11-step process, Sherman Oaks location. Research services, pricing, areas served.",Horderly,https://horderly.com,"Sherman Oaks, Los Angeles; Travel nationwide for projects over $8,000",In-Home Organizing; Custom Build-Outs; Unpack & Set-up; Virtual Organizing,"Residential, Commercial, Moves",Not publicly listed for in-home services; Virtual organizing sessions are $300 per session.,11-step organizing process; Proprietary line of organizing products; Virtual organizing services,NAPO member; Featured in Today Show,Jamie and Fillip Hord,2015,Team of trained organizers,
"Straighten Up by Janelle - straightenupbyjanelle.com - Celebrity home organizer and TV personality, appearances on The Today Show. Research services, pricing, celebrity clients, media features.",Straighten Up by Janelle,http://straightenupbyjanelle.com,"Los Angeles, and clients all over the globe",Home organizing; Virtual consultations; In-person consultations; Interior decorating,Residential,Not publicly listed,Celebrity home organizer; TV personality; Author of 'The Folding Book'; Straighten Up Method,Featured on The Today Show; Good Morning America; Business Insider,Janelle Lam,Not found,Not found,
"Harmony Living by V - harmonylivingbyv.com - 30 years experience serving celebrities, executives, luxury homes in LA and Orange County. Research services, pricing, areas served.",Harmony Living by V,https://harmonylivingbyv.com,"Los Angeles County, Orange County, Beverly Hills, Manhattan Beach, Pasadena, Newport Beach, Irvine, Huntington Beach",Move-In & Move-Out Support; Home Transition & Estate Organization; Professional Organization; Personal Assistant Services,"Residential, Moves, Estates","$250 for a half day and $400 for a full day. For larger or more complex projects, a customized quote will be provided after a free consultation.",30 years of experience; Australian heritage approach; Celebrity clientele; Comprehensive lifestyle services,Not found,V,1995,Solo with subcontractors,
"Leave It 2 Lori - leaveit2lori.com - Professional home organizing in LA, Ventura County, San Fernando Valley. Research services, pricing, areas served.",Leave It 2 Lori & Roz,https://leaveit2lori.com,"Agoura Hills, Beverly Hills, Bel Air, Brentwood, Calabasas, Camarillo, Encino, Hidden Hills, Holmby Hills, West Hollywood, Indian Wells, La Cañada Flintridge, Lake Sherwood, La Quinta, Los Angeles, Malibu, Manhattan Beach, Marina Del Rey, Moorpark, Oak Park, Palm Desert, Palm Spings, Rancho Mirage, San Fernando Valley, Santa Monica, Sherman Oaks, Simi Valley, Studio City, Thousand Oaks, Toluca Lake, Westlake Village",Home organizing; Office organization; Moving services; Estate clearing; Home staging; Home inventory; Wine inventory; Professional shopping; Virtual organizing; Space planning; Staff training,"Residential, Commercial, Moves, Estates",Not publicly listed,"Over 30 years of combined experience; Full-service concierge moving; Specialize in large, multi-faceted projects; Extensive network of trusted vendors",NAPO member; Golden Circle honors from NAPO,Lori Gersh and Rosalind Lakomy,2014,Team of organizing professionals,
"Golden West Organizing - goldenwestorganizing.com - Professional organizer in Encino area. Research services, pricing, areas served.",Golden West Organizing,https://www.goldenwestorganizing.com/,"Greater Los Angeles, Orange County",Home organizing; Unpacking; Decluttering; Space planning; Virtual coaching; Quarterly VIP sessions,"Residential, Moves",Single-day sessions start at $900; Virtual coaching sessions with Dr. Raz are available at $250/hour,"Founder holds a Ph.D. in Communication; Warm, compassionate, and non-judgmental approach; Business name is a tribute to the founder's late grandfather, an entrepreneur.",Not found,Dr. Julia Raz,2021,Team of 2-10 employees,
"Spark Organizers - sparkorganizers.com - Topanga-based, luxury home organizing, NAPO member. Research services, pricing, areas served, differentiators.",Spark Organizers,https://sparkorganizers.com,"Los Angeles, Ventura, Topanga",Home organizing; Closet organizing; Move management; Unpacking; Paper organization; Desk ergonomics; Space planning; Downsizing,"Residential, Moves, Downsizing",Not publicly listed,"Luxury home organizing; The Spark nest Method™; ""Happi*nest*, Guaranteed""; Focus on ""flow, clarity, and beauty""; Serves busy professionals, luxury homeowners, and seniors; Integrates systems thinking and intentional design; Offers ""functional wellness tools"" like HeartMath and Sensate 2",NAPO Registered & Insured Business; Residential Organizing Specialist; NAPO LA: Serving as Secretary & Admin Director; Trustworthy Certified Expert; Precision Nutrition Coach; Metabolic Certified Advocate (wellness); HearthMath Certified Practitioner; Brain Based Specialist; Move Management Specialist; Life Transition Specialist; Certified Coach,Paula Pham,Not found,Solo with industry partners,
"A Clear Path - aclearpath.net - Specializes in hoarding remediation, estate clear-outs, and move management. Research services, pricing, areas served.",A Clear Path,https://www.aclearpath.net,"Los Angeles, Orange County",Full Move Management; Online Estate Auctions; Estate Clear Outs; Household Inventories; Declutter & Organize; Unpack & Organize; End of Life Organizing; Senior Downsizing; Hoarding Clean Up; City Code Enforcement,"Residential, Estates, Chronically Disorganized, Senior Downsizing",Not publicly listed,"Specializes in chronic disorganization, ADHD, and hoarding; brain-based approach to organizing; team approach to decluttering",Certified Professional Organizer (CPO®); Institute for Challenging Disorganization,Regina Lark,2008,Team of 15+,
"Making Space Today - makingspace.today - Professional organizing service in LA for kitchens, pantries, and more. Research services, pricing, areas served.",Making Space Today,https://www.makingspace.today/,"Los Angeles, CA, Santa Clarita Valley, CA",Full Service Organizing; DIY Organizing Consultations; Moving and Unpacking Services; Custom Closet Design,"Residential, Moves, Custom Closet Design",Not publicly listed,Contracted In-Home Organizing partner of The Container Store; Personalized approach from the founder; Focus on creating functional and aesthetically pleasing spaces,Contracted In-Home Organizing partner of The Container Store,Alysha Fenn,Not found,Team of organizers,
"The Organizing Shift - Professional organizer in LA area. Search for their website and research services, pricing, areas served.",The Organizing Shift,https://www.theorganizingshift.com/,"Los Angeles, San Fernando Valley",1:1 Decluttering and Organizing; 1:1 EFT Tapping; Group Tapping and Declutter Coaching,"Residential, Kitchen & Pantry Decluttering, Clothes & Closets, Garage Reorganization",Not publicly listed,EFT Tapping; KonMari Specialist,Certified Clinical EFT Practitioner; Certified KonMari Specialist,Raleigh West,Not found,Team of 3+,
"Simply Organized by Kari Jane - Top-rated on Yelp with 125 reviews, LA area. Search for their website and research services, pricing, areas served.",Simply Organized by Kari Jane,https://simplyorganizedbykj.com/,"West Los Angeles, Santa Monica, Manhattan Beach, Beverly Hills, Playa Vista, Marina del Rey, the Heart of the Valley, Hermosa Beach, Redondo Beach, Venice","Home Organization; Office Organization; Commercial Office Organization; Wardrobe Organization, Therapy and Enhancement; Spacial Planning; Re-location Coordination; Eliminating clutter","Residential, Commercial, Moves",Not publicly listed,Where style meets organization; Stylish organizational solutions; Three-part organizational process; Labeling and sourcing of organizational materials,Not found,Kari Jane,2013,Team of organizers,
"Clutter Girl - Professional organizer in LA area. Search for their website and research services, pricing, areas served.",Clutter Girl L.A.,https://www.cluttergirlla.com/,"Los Angeles, Southern California",Home Organization; Space Planning; Paperwork; Move Coordination; Packing/Unpacking; Senior Downsizing,"Residential, Moves, Senior Downsizing","$350 for a 4-hour ""Getting Your Feet Wet"" session; 4-hour minimum for other services",Non-judgmental and flexible approach; Focus on the emotional aspects of decluttering; Superhero branding,Not found,Not found,2017,Team of unspecified size,
"The Joyful Organizer - Professional organizer in LA area. Search for their website and research services, pricing, areas served.",The Joyful Organizer,https://joyfulorganizer4you.com/,Los Angeles,Decluttering; Purging; Donating; Reorganizing; Check-In,"Residential, Home Office",Not publicly listed,ADHD-informed; Customized solutions; Follow-up check-ins,Not found,LB Baer,Not found,Solo with subcontractors,
"iOrganize - iorganize.co - Neurospicy professional organizer of 15+ years, LA area. Research services, pricing, areas served.",iOrganize,https://iorganize.co/,"Shreveport, LA (Note: The prompt specified the LA area, but the researched website is for a business in Shreveport, LA. There appears to be another business with a similar name that may be the one in the LA area.)",Home organizing; Closet organizing; Move management; Unpacking; Decluttering; Packing; Space planning; Decorating; Holiday Decor,Residential,Not publicly listed on iorganize.co. Another iOrganize business website mentions $150/hr with a 3-hour minimum.,Neurospicy professional organizer of 15+ years; ADHD-informed; Published author and content creator,Not found,"Rachel, Christen Fackler",Not found,Solo with subcontractors,
"The Organistas - theorganistas.com - San Fernando Valley based, decluttering and organizing with interior styling. Research services, pricing, areas served.",The Organistas,https://www.theorganistas.com,"San Fernando Valley, Los Angeles, CA",Home organizing; Closet organizing; Decluttering; Interior styling; Move management; Unpacking; Garage organization,Residential,Not publicly listed,Decluttering and organizing with interior styling; Focus on functionality and aesthetics,Not found,Yael,Not found,Not found,
