Subject,Business Name,Website,Location / Areas Served,Services Offered,Project Scopes,Pricing,Differentiators / USPs,Certifications & Affiliations,Founder / Owner,Year Founded,Team Size,Error
"Spaces of Mind - spacesofmind.com - Hollywood-based, ADHD specialists, move managers, transitional consultants. Founded 2018 by Kimi Liope. Research services, pricing, areas served.",Spaces of Mind,https://spacesofmind.com,"Hollywood, Los Angeles","Moving Assistance; Welcoming a Baby; Navigating Separation; Disability Adjustments; Senior Transitions; Grief Cleaning; General Downsize & Maintenance; Garage/Storage Organization; Paperwork Management; Perfection Services; Holiday, Event Storage & Set-Up; Small Business Support; Emergency Preparedness; Inventory Management","Residential, Commercial, Moves",Not publicly listed,ADHD specialists; Transitional consultants; Move managers; Holistic approach integrating emotional and psychological support,Not found,Kimi Liope,2018,Not found,
"Swoon Spaces - swoonspaces.com - Luxury home organization in NYC and LA, serving Beverly Hills, Bel Air, West Hollywood. Research services, pricing, areas served.",Swoon Spaces,https://swoonspaces.com,"Beverly Hills, Bel Air, Pacific Palisades, Malibu",The Swoon Edit; Full Service Organization; Move Management; Custom Closets; Nursery Preparation; Seasonal Decor; Home Concierge; Renovation Transitions,"Residential, Moves, Renovations",Not publicly listed,Luxury home organization; High-profile clientele; Discretion and privacy; Projects personally led by founder; Wellness-based approach (founder is a certified yoga instructor),Certified yoga instructor (founder); Featured in People Magazine; Featured in Bravo TV; Featured in Apartment Therapy,Natalie Ron,Not found,"Team of organizers, designers, and move specialists",
"ShipShaped Home - shipshapedhome.com - South Bay LA (Manhattan Beach, Hermosa Beach, Redondo Beach, Palos Verdes). Research services, pricing, areas served.",ShipShaped Home,https://shipshapedhome.com,"Manhattan Beach, Hermosa Beach, Redondo Beach, Palos Verdes, Los Angeles South Bay, Long Beach",Expert organizing + ongoing maintenance sessions; Virtual organizing sessions; Pre-Move Services; Unpack Services,"Residential, Moves",Virtual Organizing Session: $250/2-hour Session; Other pricing not publicly listed,Founder has a background in Apparel Manufacturing Management and a keen eye for interior decorating and design; Focus on creating a home organization system that works for the client,Bonded and Insured,Carli Roe,2013,Team of 3+,
"The Spatial Guy - thespatialguy.com - LA organizer based in Silver Lake area. Research services, pricing, areas served.",The Spatial Guy,https://www.thespatialguy.com,"West Hollywood, Silver Lake, Santa Monica, Beverly Hills, Pasadena, Echo Park, Culver City, Downtown LA","Decluttering & Organization; Virtual Organizing; Room-by-Room Organizing; Specialty Services (Move-in/move-out organizing, packing/unpacking, holiday decoration storage, home staging prep, paper and digital file organization)","Residential, Commercial",Not publicly listed,Background in branding and visual merchandising; Neurodiversity-affirming approach; Personalized service; Judgment-free,NAPO member; Previously served on the board of NAPO Los Angeles,Jon Siegel,Not found,Solo with subcontractors,
"Elev8 Your Spaces - elev8yourspaces.com - 20+ years experience, works with hoarders, LA area. Research services, pricing, areas served.",Elev8 Your Spaces,https://elev8yourspaces.com,"Los Angeles, California",Consultation; Declutter & Organize; Move-In/Out Concierge; Virtual/In-person Coaching; Home organizing; Closet organizing; Office organizing; Children's room organizing; Storage unit organizing; Retail space organizing; Garage organizing,"Residential, Commercial, Moves",Not publicly listed,"Specializes in working with neurodivergent individuals (Autism, ADHD) and those with depression; Empathetic approach; Accountability coaching; Personalized four-step organizational program; Founder has a background in Early Childhood Education Development Studies",Not found,Laela Storti,Not found,Solo operator,
"Sorted & Stored - sortedstored.com - Professional organizing company in LA. Research services, pricing, areas served.",Sorted & Stored,https://www.sortedstored.com,"Los Angeles, Orange County",Residential Organizing; Home Organizing; Packing and Unpacking; Junk Removal; Virtual Organizing,"Residential, Business",Not publicly listed,The Sorted and Stored Method is born from a deep understanding of urban living; It's about more than just decluttering; it's about carving a space for yourself.,Not found,Melina,Not found,Solo operator,
